{
  "structure": "Code-review gate (stipulated description)",
  "source": "prose.md",
  "parties": [
    {
      "label": "A",
      "name": "author",
      "active": "change ready"
    },
    {
      "label": "G",
      "name": "CI gate",
      "active": "passing"
    },
    {
      "label": "M",
      "name": "maintainer",
      "active": "approving"
    }
  ],
  "mediator": "G",
  "encodings": [
    {
      "id": "gated",
      "account": "maintainers wait for CI",
      "role": "rival",
      "rules": {
        "A": "G and M",
        "G": "A",
        "M": "A and G"
      },
      "evidence": {
        "A": [
          {
            "source": "prose.md",
            "locator": "¶4",
            "quote": "I push a fix when CI fails or when the maintainer asks for changes, and I stop when both are satisfied."
          }
        ],
        "G": [
          {
            "source": "prose.md",
            "locator": "¶2",
            "quote": "The CI check runs on every push to the change."
          }
        ],
        "M": [
          {
            "source": "prose.md",
            "locator": "¶3",
            "quote": "Maintainers approve only changes whose CI check is green."
          }
        ]
      },
      "alternative": {
        "G": {
          "rule": "A",
          "why": "The gate's rule is the same under both readings; what varies is whether the maintainer reads it (¶5)."
        }
      },
      "predicted": {
        "structure": "triadic",
        "core": [
          "A",
          "G",
          "M"
        ],
        "reason": "The gate commits a pass/fail neither author nor maintainer sets, and both read it."
      }
    },
    {
      "id": "diff_only",
      "account": "maintainers approve on the diff alone",
      "role": "rival",
      "rules": {
        "A": "G and M",
        "G": "A",
        "M": "A"
      },
      "evidence": {
        "A": [
          {
            "source": "prose.md",
            "locator": "¶4",
            "quote": "I push a fix when CI fails or when the maintainer asks for changes, and I stop when both are satisfied."
          }
        ],
        "G": [
          {
            "source": "prose.md",
            "locator": "¶2",
            "quote": "The CI check runs on every push to the change."
          }
        ],
        "M": [
          {
            "source": "prose.md",
            "locator": "¶5",
            "quote": "On small changes I just read the diff and approve; I don't wait for CI."
          }
        ]
      },
      "alternative": {
        "G": {
          "rule": "A",
          "why": "As above; the gate's own rule does not change."
        }
      },
      "predicted": {
        "structure": "triadic",
        "core": [
          "A",
          "M"
        ],
        "reason": "If the maintainer ignores the gate, the author-maintainer pair should carry the coordination."
      }
    }
  ]
}